{
  "api_version": "edbg.operation.draft/0",
  "connection": {
    "id": "console-uart",
    "revision": 1
  },
  "action": "uart.write",
  "params": {
    "session_id": "session-example",
    "data_hex": "68656c6c6f0a"
  },
  "idempotency_key": "example-intent-uart-write",
  "timing": {
    "dispatch_within_ms": 5000,
    "execution_timeout_ms": 30000
  }
}
